{
  "schema_version": "1.0",
  "validation_id": "validation_ecdde61c272049d1be61220fc85a257d",
  "application_id": "app_synthetic_draft_002",
  "application_revision": 1,
  "issues": [
    {
      "issue_id": "issue_c14025549723459bbdb928948dd74e24",
      "type": "unsupported",
      "severity": "info",
      "field": "patient.medical_summary",
      "message": "该事实仅来自用户陈述，不代表材料证明或平台审核通过。",
      "related_fact_ids": [
        "fact_uncertain_001"
      ]
    },
    {
      "issue_id": "issue_98632de866844843ba77225f04f936fc",
      "type": "unsupported",
      "severity": "info",
      "field": "treatment.paid_cost",
      "message": "该事实仅来自用户陈述，不代表材料证明或平台审核通过。",
      "related_fact_ids": [
        "fact_uncertain_002"
      ]
    },
    {
      "issue_id": "issue_5797a21ba1fc467b8631dff0cb2ba3c6",
      "type": "invalid_format",
      "severity": "blocking",
      "field": "treatment.estimated_cost",
      "message": "事实取值类型与已配置的字段规则不一致。",
      "related_fact_ids": [
        "fact_uncertain_003"
      ]
    },
    {
      "issue_id": "issue_ba8ee72f04064ca59b54c3725966c3b1",
      "type": "unsupported",
      "severity": "info",
      "field": "treatment.estimated_cost",
      "message": "该事实仅来自用户陈述，不代表材料证明或平台审核通过。",
      "related_fact_ids": [
        "fact_uncertain_003"
      ]
    },
    {
      "issue_id": "issue_d0ae0a94d1294b17a5d4d0c5e2265b60",
      "type": "missing",
      "severity": "blocking",
      "field": "documents",
      "message": "缺少已完成解析的证明材料。",
      "related_fact_ids": []
    }
  ],
  "can_finalize": false,
  "evaluated_at": "2026-10-16T12:12:46Z"
}
