{
  "schema_version": "1.0",
  "validation_id": "validation_669fa4fb997a41d79f60175b40b1aa50",
  "application_id": "app_demo_004",
  "application_revision": 1,
  "issues": [
    {
      "issue_id": "issue_0c7fb935a85741eeac7f0671691f79d5",
      "type": "unsupported",
      "severity": "info",
      "field": "patient.relationship_to_applicant",
      "message": "该事实仅来自用户陈述，不代表材料证明或平台审核通过。",
      "related_fact_ids": [
        "fact_001"
      ]
    },
    {
      "issue_id": "issue_b1f09c4c7af94d88a297b0b4555bf62e",
      "type": "missing",
      "severity": "blocking",
      "field": "patient.medical_summary",
      "message": "缺少规则要求的事实，请补充信息或材料。",
      "related_fact_ids": []
    }
  ],
  "can_finalize": false,
  "evaluated_at": "2026-10-16T12:12:46Z"
}
